{"$defs":{"identity":{"additionalProperties":false,"properties":{"byte_count":{"maximum":2147483647,"minimum":1,"type":"integer"},"sha256":{"not":{"const":"0000000000000000000000000000000000000000000000000000000000000000"},"pattern":"^[0-9a-f]{64}$","type":"string"}},"required":["byte_count","sha256"],"type":"object"}},"$schema":"https://json-schema.org/draft/2020-12/schema","additionalProperties":false,"properties":{"approved_artifacts":{"const":{"complete_bmp":{"byte_count":230454,"sha256":"5dac08fba06a53bb0a480fe388907e78147b5c0d042fee53eea2ff81b4ee8bc6"},"ready_bmp":{"byte_count":230454,"sha256":"4f471fd3bc87f53fef9d7f200eaccb0ebe69a0240a9cf09f79bc2bfec3c51f19"}}},"build_binding":{"enum":["build-pinned","build-unpinned"]},"candidate_production_manifest":{"$ref":"#/$defs/identity"},"fixed_names":{"const":{"build_manifest":"SyntheticLauncherBuildManifest.v1.json","complete_bmp":"SyntheticLauncherComplete.v1.bmp","controller":"SyntheticLauncherController.exe","locked_preflight":"SyntheticLauncherLockedPreflight.exe","private_configuration":"SyntheticLauncherController.private.v1.json","public_configuration":"SyntheticLauncherController.public.v1.json","ready_bmp":"SyntheticLauncherReady.v1.bmp","report":"SyntheticLauncherReport.v1.json","supervisor":"SyntheticLauncherSupervisor.exe","timeout_child":"SyntheticLauncherTimeoutChild.exe","timeout_root":"SyntheticLauncherTimeoutFixture.exe","ui_fixture":"SyntheticLauncherFixture.exe","worker_evidence":"SyntheticLauncherWorkerEvidence.v1.json"}},"profile_id":{"const":"cm0102-synthetic-launcher-runtime-v1"},"role_identities":{"additionalProperties":false,"properties":{"controller":{"$ref":"#/$defs/identity"},"locked_preflight":{"$ref":"#/$defs/identity"},"supervisor":{"$ref":"#/$defs/identity"},"timeout_child":{"$ref":"#/$defs/identity"},"timeout_root":{"$ref":"#/$defs/identity"},"ui_fixture":{"$ref":"#/$defs/identity"}},"required":["controller","locked_preflight","supervisor","timeout_child","timeout_root","ui_fixture"],"type":"object"},"runtime_private_schema":{"$ref":"#/$defs/identity"},"schema_version":{"const":1},"source_revision":{"not":{"const":"0000000000000000000000000000000000000000"},"pattern":"^[0-9a-f]{40}$","type":"string"}},"required":["approved_artifacts","build_binding","candidate_production_manifest","fixed_names","profile_id","role_identities","runtime_private_schema","schema_version","source_revision"],"type":"object"}
