{"approved_artifacts":{"complete_bmp":{"byte_count":230454,"sha256":"5dac08fba06a53bb0a480fe388907e78147b5c0d042fee53eea2ff81b4ee8bc6"},"ready_bmp":{"byte_count":230454,"sha256":"4f471fd3bc87f53fef9d7f200eaccb0ebe69a0240a9cf09f79bc2bfec3c51f19"}},"build_binding":"build-pinned","candidate_production_manifest":{"byte_count":1,"sha256":"1111111111111111111111111111111111111111111111111111111111111111"},"fixed_names":{"build_manifest":"SyntheticLauncherBuildManifest.v1.json","complete_bmp":"SyntheticLauncherComplete.v1.bmp","controller":"SyntheticLauncherController.exe","locked_preflight":"SyntheticLauncherLockedPreflight.exe","private_configuration":"SyntheticLauncherController.private.v1.json","public_configuration":"SyntheticLauncherController.public.v1.json","ready_bmp":"SyntheticLauncherReady.v1.bmp","report":"SyntheticLauncherReport.v1.json","supervisor":"SyntheticLauncherSupervisor.exe","timeout_child":"SyntheticLauncherTimeoutChild.exe","timeout_root":"SyntheticLauncherTimeoutFixture.exe","ui_fixture":"SyntheticLauncherFixture.exe","worker_evidence":"SyntheticLauncherWorkerEvidence.v1.json"},"profile_id":"cm0102-synthetic-launcher-runtime-v1","role_identities":{"controller":{"byte_count":1,"sha256":"2222222222222222222222222222222222222222222222222222222222222222"},"locked_preflight":{"byte_count":1,"sha256":"3333333333333333333333333333333333333333333333333333333333333333"},"supervisor":{"byte_count":1,"sha256":"4444444444444444444444444444444444444444444444444444444444444444"},"timeout_child":{"byte_count":1,"sha256":"5555555555555555555555555555555555555555555555555555555555555555"},"timeout_root":{"byte_count":1,"sha256":"6666666666666666666666666666666666666666666666666666666666666666"},"ui_fixture":{"byte_count":14336,"sha256":"f469671fd3d8f4986ced0448a70a023d225ed529802cee63cabb43f6fbca2ad6"}},"runtime_private_schema":{"byte_count":1,"sha256":"7777777777777777777777777777777777777777777777777777777777777777"},"schema_version":1,"source_revision":"1111111111111111111111111111111111111111"}
